{
 "schemaVersion": "1.0",
 "date": "2026-10-18",
 "generatedAt": "2026-10-18T09:20:29+02:00",
 "title": "Tech Daily — Manifestations du 17 octobre, agenda boursier et échéances de novembre",
 "summary": "Retour sur la mobilisation du 17 octobre et ses incidents à Grenoble, agenda des résultats d'entreprises de la semaine du 19 au 23 octobre, et calendrier des échéances d'entreprise de novembre.",
 "highlights": [
  "Mobilisation du 17 octobre : manifestations dans plusieurs villes, incidents à Grenoble",
  "CAC 40 à 7 956,70 points vendredi ; EssilorLuxottica, Michelin, Netflix et Tesla publient cette semaine",
  "Entreprises : les échéances de novembre à vérifier dans votre espace professionnel"
 ],
 "meta": {
  "generator": "claude-scheduled-task"
 },
 "posts": [
  {
   "id": "mobilisation-17-octobre-2026-manifestations-grenoble-pouvoir-achat",
   "category": "politique",
   "title": "Mobilisation du 17 octobre : manifestations dans plusieurs villes, incidents à Grenoble",
   "summary": "Des rassemblements étaient prévus samedi à Paris, Rennes, Lille, Bordeaux et Grenoble. À Grenoble, un cortège de plusieurs milliers de personnes a été suivi de scènes de désordre en centre-ville.",
   "tags": [
    "manifestation",
    "Grenoble",
    "pouvoir d'achat",
    "mobilisation sociale",
    "ordre public"
   ],
   "importance": 3,
   "readingMinutes": 6,
   "publishedAt": "2026-10-18T09:20:29+02:00",
   "icon": "📣",
   "illustration": {
    "svg": "<svg xmlns='http://www.w3.org/2000/svg' viewBox='0 0 640 360'><defs><linearGradient id='g' x1='0' y1='0' x2='1' y2='1'><stop offset='0' stop-color='hsl(350,62%,30%)'/><stop offset='1' stop-color='hsl(30,66%,50%)'/></linearGradient></defs><rect width='640' height='360' fill='url(#g)'/><circle cx='115' cy='183' r='106' fill='#fff' fill-opacity='.10'/><circle cx='586' cy='255' r='142' fill='#fff' fill-opacity='.08'/><circle cx='320' cy='170' r='92' fill='none' stroke='#fff' stroke-width='3' stroke-opacity='.8'/><circle cx='412' cy='172' r='7' fill='#fff' fill-opacity='.9'/><circle cx='393' cy='226' r='7' fill='#fff' fill-opacity='.9'/><circle cx='347' cy='258' r='7' fill='#fff' fill-opacity='.9'/><circle cx='288' cy='256' r='7' fill='#fff' fill-opacity='.9'/><circle cx='238' cy='211' r='7' fill='#fff' fill-opacity='.9'/><circle cx='228' cy='162' r='7' fill='#fff' fill-opacity='.9'/><circle cx='252' cy='108' r='7' fill='#fff' fill-opacity='.9'/><circle cx='294' cy='82' r='7' fill='#fff' fill-opacity='.9'/><circle cx='349' cy='83' r='7' fill='#fff' fill-opacity='.9'/><circle cx='400' cy='125' r='7' fill='#fff' fill-opacity='.9'/><rect x='270' y='120' width='100' height='100' rx='16' fill='#fff' fill-opacity='.2'/><text x='320' y='194' font-size='64' text-anchor='middle'>📣</text><rect x='113' y='300' width='250' height='8' rx='4' fill='#fff' fill-opacity='.3'/><rect x='118' y='318' width='102' height='8' rx='4' fill='#fff' fill-opacity='.2'/></svg>"
   },
   "sources": [
    {
     "title": "17 octobre à Grenoble : un immeuble évacué après un incendie, 400 casseurs pillent le centre-ville en marge de la manifestation",
     "url": "https://france3-regions.franceinfo.fr/auvergne-rhone-alpes/isere/grenoble/17-octobre-a-grenoble-premiers-blocages-et-commerces-barricades-avant-les-rassemblements-cet-apres-midi-3435018.html",
     "publisher": "France 3 Auvergne-Rhône-Alpes"
    },
    {
     "title": "Grenoble : les Gilets jaunes de retour dans la rue samedi 17 octobre, aux côtés cette fois des lycéens et des étudiants",
     "url": "https://www.placegrenet.fr/2026/10/16/grenoble-les-gilets-jaunes-de-retour-dans-la-rue-samedi-17-octobre-aux-cotes-cette-fois-des-lyceens-et-des-etudiants/691685",
     "publisher": "Place Gre'net"
    },
    {
     "title": "À Grenoble, une mobilisation du 17 octobre entre manifestation pacifique et scènes de chaos en centre-ville",
     "url": "https://www.ici.fr/emissions/l-info-d-ici-matin-ici-isere/a-grenoble-une-mobilisation-du-17-octobre-entre-manifestation-pacifique-et-scenes-de-chaos-en-centre-ville-5958666",
     "publisher": "ICI"
    }
   ],
   "blocks": [
    {
     "type": "callout",
     "variant": "info",
     "title": "Neutralité et limites",
     "text": "Cet article s'appuie sur des médias régionaux. Les bilans officiels, les chiffres exacts et les identités des auteurs de violences ne sont pas établis dans les sources consultées. Les positions rapportées sont celles des organisateurs, de la police ou de la préfecture, présentées comme telles."
    },
    {
     "type": "paragraph",
     "text": "Samedi **17 octobre 2026**, des manifestations étaient prévues dans plusieurs villes de France, dont Paris, Rennes, Lille, Bordeaux et Grenoble, selon la presse. À Grenoble, l'appel émanait des Gilets jaunes locaux, qui souhaitaient élargir la mobilisation aux lycéens, aux étudiants et aux syndicats. Le cortège devait partir de la place Victor-Hugo à 13 h 30."
    },
    {
     "type": "heading",
     "level": 2,
     "text": "Les revendications annoncées"
    },
    {
     "type": "paragraph",
     "text": "D'après l'appel relayé par Place Gre'net, les organisateurs dénoncent un « gouvernement des riches » et la répression policière des mouvements sociaux. Parmi les thèmes évoqués figurent le pouvoir d'achat, la justice fiscale, les services publics et le référendum d'initiative citoyenne. Une manifestation antifasciste était par ailleurs annoncée à 15 h à Grenoble. Ces revendications s'inscrivent dans un contexte de débat budgétaire : le projet de loi de finances pour 2027 est en cours d'examen à l'Assemblée nationale depuis le 13 octobre."
    },
    {
     "type": "heading",
     "level": 2,
     "text": "Ce qui s'est passé à Grenoble"
    },
    {
     "type": "paragraph",
     "text": "ICI décrit une mobilisation « entre manifestation pacifique et scènes de chaos en centre-ville ». Selon la même source, plus de 5 000 personnes ont défilé d'après la police, et 10 000 d'après les organisateurs : l'écart entre ces deux chiffres est habituel et reflète des méthodes de comptage différentes."
    },
    {
     "type": "paragraph",
     "text": "Selon France 3 Auvergne-Rhône-Alpes, un immeuble a été évacué après un incendie et la préfecture évoque entre 300 et 400 personnes impliquées dans des violences et des dégradations. Nous n'avons pas retrouvé de bilan officiel complet (blessés, interpellations) ni d'éléments permettant d'attribuer précisément ces actes. Il faut donc s'en tenir aux déclarations rapportées."
    },
    {
     "type": "keyvalue",
     "items": [
      {
       "label": "Lieu principal",
       "value": "Grenoble, départ place Victor-Hugo à 13 h 30"
      },
      {
       "label": "Participation",
       "value": "Plus de 5 000 (police) ; 10 000 (organisateurs)"
      },
      {
       "label": "Incidents",
       "value": "Violences et dégradations en centre-ville ; 300 à 400 personnes impliquées selon la préfecture"
      },
      {
       "label": "Autres villes annoncées",
       "value": "Paris, Rennes, Lille, Bordeaux"
      }
     ]
    },
    {
     "type": "diagram",
     "svg": "<svg xmlns='http://www.w3.org/2000/svg' viewBox='0 0 640 250' font-family='system-ui,sans-serif'><rect width='640' height='250' rx='14' fill='#f4f6fa'/><text x='320' y='28' font-size='15' font-weight='700' text-anchor='middle' fill='#1b2433'>Grenoble, le 17 octobre : ce que disent les sources</text><rect x='20' y='60' width='129' height='130' rx='12' fill='hsl(350,60%,92%)' stroke='hsl(350,55%,35%)' stroke-width='1.5'/><text x='84' y='90' font-size='13' font-weight='700' text-anchor='middle' fill='#1b2433'>Appel</text><text x='84' y='116' font-size='11.5' text-anchor='middle' fill='#2c3a4f'>Gilets jaunes, lycéens,</text><text x='84' y='134' font-size='11.5' text-anchor='middle' fill='#2c3a4f'>étudiants, syndicats</text><path d='M152 125 h18' stroke='hsl(350,55%,35%)' stroke-width='2.5' fill='none'/><path d='M164 118 l10 7 l-10 7z' fill='hsl(350,55%,35%)'/><rect x='177' y='60' width='129' height='130' rx='12' fill='hsl(350,60%,92%)' stroke='hsl(350,55%,35%)' stroke-width='1.5'/><text x='242' y='90' font-size='13' font-weight='700' text-anchor='middle' fill='#1b2433'>Cortège</text><text x='242' y='116' font-size='11.5' text-anchor='middle' fill='#2c3a4f'>Place Victor-Hugo,</text><text x='242' y='134' font-size='11.5' text-anchor='middle' fill='#2c3a4f'>13 h 30</text><path d='M309 125 h18' stroke='hsl(350,55%,35%)' stroke-width='2.5' fill='none'/><path d='M321 118 l10 7 l-10 7z' fill='hsl(350,55%,35%)'/><rect x='334' y='60' width='129' height='130' rx='12' fill='hsl(350,60%,92%)' stroke='hsl(350,55%,35%)' stroke-width='1.5'/><text x='398' y='90' font-size='13' font-weight='700' text-anchor='middle' fill='#1b2433'>Chiffres</text><text x='398' y='116' font-size='11.5' text-anchor='middle' fill='#2c3a4f'>5 000 (police)</text><text x='398' y='134' font-size='11.5' text-anchor='middle' fill='#2c3a4f'>10 000 (organisateurs)</text><path d='M466 125 h18' stroke='hsl(350,55%,35%)' stroke-width='2.5' fill='none'/><path d='M478 118 l10 7 l-10 7z' fill='hsl(350,55%,35%)'/><rect x='491' y='60' width='129' height='130' rx='12' fill='hsl(350,60%,92%)' stroke='hsl(350,55%,35%)' stroke-width='1.5'/><text x='556' y='90' font-size='13' font-weight='700' text-anchor='middle' fill='#1b2433'>Incidents</text><text x='556' y='116' font-size='11.5' text-anchor='middle' fill='#2c3a4f'>Dégradations en</text><text x='556' y='134' font-size='11.5' text-anchor='middle' fill='#2c3a4f'>centre-ville</text></svg>",
     "alt": "Schéma en quatre étapes de la journée du 17 octobre à Grenoble : appel, cortège, chiffres de participation, incidents.",
     "caption": "Les chiffres de participation sont ceux de la police et des organisateurs ; aucun bilan officiel complet n'a été consulté."
    },
    {
     "type": "heading",
     "level": 2,
     "text": "Comment lire ces chiffres"
    },
    {
     "type": "paragraph",